{
  "task_id": "REQ_RES_2026_01",
  "key_takeaways": [
    "Средняя ставка по сберегательным вкладам до востребования у TOP-10 банков РФ на октябрь 2026: 9.5–11.5 % годовых",
    "Приветственная ставка не должна превышать базовую более чем на 4 пп без равнозначного раскрытия МГС в карточке продукта",
    "Источник конфликта: банк A указывает приветственную ставку крупным шрифтом, МГС — мелким шрифтом в подвале страницы"
  ],
  "quantifiable_metrics": [
    {
      "metric_name": "средняя ставка вклада до востребования",
      "value": 10.5,
      "unit": "% годовых",
      "source_id": "SRC_1"
    },
    {
      "metric_name": "максимальная рекомендованная приветственная ставка",
      "value": 14.5,
      "unit": "% годовых",
      "source_id": "SRC_2"
    }
  ],
  "conflicts_and_limitations": [
    {
      "issue": "размер приветственной ставки в рекламных материалах vs МГС",
      "source_a_claim": "Приветственная ставка 18 % годовых (банк A, лендинг)",
      "source_b_claim": "МГС 10 % годовых раскрыта шрифтом меньшего размера (банк A, подвал страницы)"
    }
  ],
  "sources": [
    {
      "source_id": "SRC_1",
      "url": "https://cbr.ru/",
      "tier_level": "TIER_1",
      "reliability_score": 0.95
    },
    {
      "source_id": "SRC_2",
      "url": "https://www.rbc.ru/bankings/",
      "tier_level": "TIER_2",
      "reliability_score": 0.8
    }
  ]
}